Bus 003 Device 003: ID 051d:0002 American Power Conversion Uninterruptible Power Supply
Device Descriptor:
  bLength                18
  bDescriptorType         1
  bcdUSB               1.10
  bDeviceClass            0 (Defined at Interface level)
  bDeviceSubClass         0
  bDeviceProtocol         0
  bMaxPacketSize0         8
  idVendor           0x051d American Power Conversion
  idProduct          0x0002 Uninterruptible Power Supply
  bcdDevice            1.06
  iManufacturer           3 American Power Conversion
  iProduct                1 Back-UPS XS 700U   FW:924.Z3 .I USB FW:Z3
  iSerial                 2 3B1613X06438
  bNumConfigurations      1
  Configuration Descriptor:
    bLength                 9
    bDescriptorType         2
    wTotalLength           34
    bNumInterfaces          1
    bConfigurationValue     1
    iConfiguration          0
    bmAttributes         0xe0
      Self Powered
      Remote Wakeup
    MaxPower               24mA
    Interface Descriptor:
      bLength                 9
      bDescriptorType         4
      bInterfaceNumber        0
      bAlternateSetting       0
      bNumEndpoints           1
      bInterfaceClass         3 Human Interface Device
      bInterfaceSubClass      0 No Subclass
      bInterfaceProtocol      0 None
      iInterface              0
        HID Device Descriptor:
          bLength                 9
          bDescriptorType        33
          bcdHID               1.10
          bCountryCode           33 US
          bNumDescriptors         1
          bDescriptorType        34 Report
          wDescriptorLength    1029
          Report Descriptor: (length is 1029)
            Item(Global): Usage Page, data= [ 0x84 ] 132
                            Power Device Page
            Item(Local ): Usage, data= [ 0x04 ] 4
                            UPS
            Item(Main  ): Collection, data= [ 0x01 ] 1
                            Application
            Item(Local ): Usage, data= [ 0x24 ] 36
                            Power Summary
            Item(Main  ): Collection, data= [ 0x00 ] 0
                            Physical
            Item(Global): Report ID, data= [ 0x01 ] 1
            Item(Local ): Usage, data= [ 0xfe ] 254
                            iProduct
            Item(Local ): String Index, data= [ 0x01 ] 1
            Item(Global): Report Size, data= [ 0x08 ] 8
            Item(Global): Report Count, data= [ 0x01 ] 1
            Item(Global): Logical Minimum, data= [ 0x00 ] 0
            Item(Global): Logical Maximum, data= [ 0xff 0x00 ] 255
            Item(Main  ): Feature, data= [ 0x22 ] 34
                            Data Variable Absolute No_Wrap Linear
                            No_Preferred_State No_Null_Position Non_Volatile Bitfield
            Item(Global): Report ID, data= [ 0x02 ] 2
            Item(Local ): Usage, data= [ 0xff ] 255
                            iSerialNumber
            Item(Local ): String Index, data= [ 0x02 ] 2
            Item(Main  ): Feature, data= [ 0x22 ] 34
                            Data Variable Absolute No_Wrap Linear
                            No_Preferred_State No_Null_Position Non_Volatile Bitfield
            Item(Global): Report ID, data= [ 0x03 ] 3
            Item(Global): Usage Page, data= [ 0x85 ] 133
                            Battery System Page
            Item(Local ): Usage, data= [ 0x89 ] 137
                            iDeviceChemistry
            Item(Local ): String Index, data= [ 0x04 ] 4
            Item(Main  ): Feature, data= [ 0x22 ] 34
                            Data Variable Absolute No_Wrap Linear
                            No_Preferred_State No_Null_Position Non_Volatile Bitfield
            Item(Global): Report ID, data= [ 0x04 ] 4
            Item(Local ): Usage, data= [ 0x8f ] 143
                            iOEMInformation
            Item(Local ): String Index, data= [ 0x03 ] 3
            Item(Main  ): Feature, data= [ 0x22 ] 34
                            Data Variable Absolute No_Wrap Linear
                            No_Preferred_State No_Null_Position Non_Volatile Bitfield
            Item(Global): Report ID, data= [ 0x05 ] 5
            Item(Local ): Usage, data= [ 0x8b ] 139
                            Rechargeable
            Item(Main  ): Feature, data= [ 0x22 ] 34
                            Data Variable Absolute No_Wrap Linear
                            No_Preferred_State No_Null_Position Non_Volatile Bitfield
            Item(Global): Report ID, data= [ 0x06 ] 6
            Item(Local ): Usage, data= [ 0x44 ] 68
                            Charging
            Item(Main  ): Input, data= [ 0xa2 ] 162
                            Data Variable Absolute No_Wrap Linear
                            No_Preferred_State No_Null_Position Volatile Bitfield
            Item(Local ): Usage, data= [ 0x44 ] 68
                            Charging
            Item(Main  ): Feature, data= [ 0xa2 ] 162
                            Data Variable Absolute No_Wrap Linear
                            No_Preferred_State No_Null_Position Volatile Bitfield
            Item(Local ): Usage, data= [ 0x45 ] 69
                            Discharging
            Item(Main  ): Input, data= [ 0xa2 ] 162
                            Data Variable Absolute No_Wrap Linear
                            No_Preferred_State No_Null_Position Volatile Bitfield
            Item(Local ): Usage, data= [ 0x45 ] 69
                            Discharging
            Item(Main  ): Feature, data= [ 0xa2 ] 162
                            Data Variable Absolute No_Wrap Linear
                            No_Preferred_State No_Null_Position Volatile Bitfield
            Item(Global): Usage Page, data= [ 0x86 0xff ] 65414
                            (null)
            Item(Local ): Usage, data= [ 0x60 ] 96
                            (null)
            Item(Main  ): Input, data= [ 0xa2 ] 162
                            Data Variable Absolute No_Wrap Linear
                            No_Preferred_State No_Null_Position Volatile Bitfield
            Item(Local ): Usage, data= [ 0x60 ] 96
                            (null)
            Item(Main  ): Feature, data= [ 0xa2 ] 162
                            Data Variable Absolute No_Wrap Linear
                            No_Preferred_State No_Null_Position Volatile Bitfield
            Item(Global): Report ID, data= [ 0x07 ] 7
            Item(Global): Usage Page, data= [ 0x85 ] 133
                            Battery System Page
            Item(Local ): Usage, data= [ 0x85 ] 133
                            Manufacturer Date
            Item(Global): Report Size, data= [ 0x10 ] 16
            Item(Global): Logical Maximum, data= [ 0xff 0xff 0x00 0x00 ] 65535
            Item(Main  ): Feature, data= [ 0xa2 ] 162
                            Data Variable Absolute No_Wrap Linear
                            No_Preferred_State No_Null_Position Volatile Bitfield
            Item(Global): Report ID, data= [ 0x08 ] 8
            Item(Global): Usage Page, data= [ 0x84 ] 132
                            Power Device Page
            Item(Local ): Usage, data= [ 0x40 ] 64
                            Config Voltage
            Item(Global): Unit, data= [ 0x21 0xd1 0xf0 0x00 ] 15782177
                            System: SI Linear, Unit: Centimeter^2*Gram*Seconds^-3*Ampere^-1
            Item(Global): Unit Exponent, data= [ 0x05 ] 5
                            Unit Exponent: 5
            Item(Main  ): Feature, data= [ 0x22 ] 34
                            Data Variable Absolute No_Wrap Linear
                            No_Preferred_State No_Null_Position Non_Volatile Bitfield
            Item(Global): Report ID, data= [ 0x09 ] 9
            Item(Local ): Usage, data= [ 0x30 ] 48
                            Voltage
            Item(Main  ): Feature, data= [ 0xa2 ] 162
                            Data Variable Absolute No_Wrap Linear
                            No_Preferred_State No_Null_Position Volatile Bitfield
            Item(Global): Report ID, data= [ 0x0a ] 10
            Item(Local ): Usage, data= [ 0xfd ] 253
                            iManufacturer
            Item(Global): Report Size, data= [ 0x08 ] 8
            Item(Global): Logical Maximum, data= [ 0xff 0x00 ] 255
            Item(Global): Unit, data= [ 0x00 ] 0
                            System: None, Unit: (None)
            Item(Global): Unit Exponent, data= [ 0x00 ] 0
                            Unit Exponent: 0
            Item(Local ): String Index, data= [ 0x03 ] 3
            Item(Main  ): Feature, data= [ 0x22 ] 34
                            Data Variable Absolute No_Wrap Linear
                            No_Preferred_State No_Null_Position Non_Volatile Bitfield
            Item(Global): Report ID, data= [ 0x0b ] 11
            Item(Global): Usage Page, data= [ 0x85 ] 133
                            Battery System Page
            Item(Local ): Usage, data= [ 0x2c ] 44
                            Capacity Mode
            Item(Main  ): Feature, data= [ 0x22 ] 34
                            Data Variable Absolute No_Wrap Linear
                            No_Preferred_State No_Null_Position Non_Volatile Bitfield
            Item(Global): Report ID, data= [ 0x0c ] 12
            Item(Local ): Usage, data= [ 0x66 ] 102
                            Remaining Capacity
            Item(Global): Logical Maximum, data= [ 0x64 ] 100
            Item(Main  ): Input, data= [ 0xa2 ] 162
                            Data Variable Absolute No_Wrap Linear
                            No_Preferred_State No_Null_Position Volatile Bitfield
            Item(Local ): Usage, data= [ 0x66 ] 102
                            Remaining Capacity
            Item(Main  ): Feature, data= [ 0xa2 ] 162
                            Data Variable Absolute No_Wrap Linear
                            No_Preferred_State No_Null_Position Volatile Bitfield
            Item(Local ): Usage, data= [ 0x68 ] 104
                            Run Time To Empty
            Item(Global): Report Size, data= [ 0x10 ] 16
            Item(Global): Logical Maximum, data= [ 0xff 0xff 0x00 0x00 ] 65535
            Item(Global): Unit, data= [ 0x01 0x10 ] 4097
                            System: SI Linear, Unit: Seconds
            Item(Main  ): Input, data= [ 0xa2 ] 162
                            Data Variable Absolute No_Wrap Linear
                            No_Preferred_State No_Null_Position Volatile Bitfield
            Item(Local ): Usage, data= [ 0x68 ] 104
                            Run Time To Empty
            Item(Main  ): Feature, data= [ 0xa2 ] 162
                            Data Variable Absolute No_Wrap Linear
                            No_Preferred_State No_Null_Position Volatile Bitfield
            Item(Global): Report ID, data= [ 0x0d ] 13
            Item(Local ): Usage, data= [ 0x83 ] 131
                            Design Capacity
            Item(Global): Report Size, data= [ 0x08 ] 8
            Item(Global): Logical Maximum, data= [ 0x64 ] 100
            Item(Global): Unit, data= [ 0x00 ] 0
                            System: None, Unit: (None)
            Item(Main  ): Feature, data= [ 0x22 ] 34
                            Data Variable Absolute No_Wrap Linear
                            No_Preferred_State No_Null_Position Non_Volatile Bitfield
            Item(Global): Report ID, data= [ 0x0e ] 14
            Item(Local ): Usage, data= [ 0x67 ] 103
                            Full Charge Capacity
            Item(Main  ): Feature, data= [ 0x22 ] 34
                            Data Variable Absolute No_Wrap Linear
                            No_Preferred_State No_Null_Position Non_Volatile Bitfield
            Item(Global): Report ID, data= [ 0x0f ] 15
            Item(Local ): Usage, data= [ 0x8c ] 140
                            Warning Capacity Limit
            Item(Main  ): Feature, data= [ 0x22 ] 34
                            Data Variable Absolute No_Wrap Linear
                            No_Preferred_State No_Null_Position Non_Volatile Bitfield
            Item(Global): Report ID, data= [ 0x10 ] 16
            Item(Local ): Usage, data= [ 0x8e ] 142
                            Capacity Granularity 2
            Item(Main  ): Feature, data= [ 0x22 ] 34
                            Data Variable Absolute No_Wrap Linear
                            No_Preferred_State No_Null_Position Non_Volatile Bitfield
            Item(Global): Report ID, data= [ 0x11 ] 17
            Item(Local ): Usage, data= [ 0x29 ] 41
                            Remaining Capacity Limit
            Item(Global): Logical Minimum, data= [ 0x01 ] 1
            Item(Main  ): Feature, data= [ 0xa2 ] 162
                            Data Variable Absolute No_Wrap Linear
                            No_Preferred_State No_Null_Position Volatile Bitfield
            Item(Global): Report ID, data= [ 0x12 ] 18
            Item(Local ): Usage, data= [ 0x8d ] 141
                            Capacity Granularity 1
            Item(Global): Logical Minimum, data= [ 0x00 ] 0
            Item(Main  ): Feature, data= [ 0x22 ] 34
                            Data Variable Absolute No_Wrap Linear
                            No_Preferred_State No_Null_Position Non_Volatile Bitfield
            Item(Global): Report ID, data= [ 0x13 ] 19
            Item(Local ): Usage, data= [ 0xd0 ] 208
                            AC Present
            Item(Global): Logical Maximum, data= [ 0x01 ] 1
            Item(Main  ): Input, data= [ 0xa2 ] 162
                            Data Variable Absolute No_Wrap Linear
                            No_Preferred_State No_Null_Position Volatile Bitfield
            Item(Local ): Usage, data= [ 0xd0 ] 208
                            AC Present
            Item(Main  ): Feature, data= [ 0xa2 ] 162
                            Data Variable Absolute No_Wrap Linear
                            No_Preferred_State No_Null_Position Volatile Bitfield
            Item(Global): Report ID, data= [ 0x14 ] 20
            Item(Local ): Usage, data= [ 0x42 ] 66
                            Below Remaining Capacity Limit
            Item(Main  ): Input, data= [ 0xa2 ] 162
                            Data Variable Absolute No_Wrap Linear
                            No_Preferred_State No_Null_Position Volatile Bitfield
            Item(Local ): Usage, data= [ 0x42 ] 66
                            Below Remaining Capacity Limit
            Item(Main  ): Feature, data= [ 0xa2 ] 162
                            Data Variable Absolute No_Wrap Linear
                            No_Preferred_State No_Null_Position Volatile Bitfield
            Item(Global): Usage Page, data= [ 0x84 ] 132
                            Power Device Page
            Item(Local ): Usage, data= [ 0x69 ] 105
                            Shutdown  Imminent
            Item(Main  ): Input, data= [ 0xa2 ] 162
                            Data Variable Absolute No_Wrap Linear
                            No_Preferred_State No_Null_Position Volatile Bitfield
            Item(Local ): Usage, data= [ 0x69 ] 105
                            Shutdown  Imminent
            Item(Main  ): Feature, data= [ 0xa2 ] 162
                            Data Variable Absolute No_Wrap Linear
                            No_Preferred_State No_Null_Position Volatile Bitfield
            Item(Global): Report ID, data= [ 0x15 ] 21
            Item(Local ): Usage, data= [ 0x57 ] 87
                            Delay Before Shutdown
            Item(Global): Report Size, data= [ 0x10 ] 16
            Item(Global): Logical Minimum, data= [ 0xff 0xff ] 65535
            Item(Global): Logical Maximum, data= [ 0xff 0x7f ] 32767
            Item(Global): Unit, data= [ 0x01 0x10 ] 4097
                            System: SI Linear, Unit: Seconds
            Item(Main  ): Feature, data= [ 0xa2 ] 162
                            Data Variable Absolute No_Wrap Linear
                            No_Preferred_State No_Null_Position Volatile Bitfield
            Item(Local ): Usage, data= [ 0x02 ] 2
                            Present Status
            Item(Main  ): Collection, data= [ 0x02 ] 2
                            Logical
            Item(Global): Report ID, data= [ 0x16 ] 22
            Item(Global): Usage Page, data= [ 0x85 ] 133
                            Battery System Page
            Item(Global): Unit, data= [ 0x00 ] 0
                            System: None, Unit: (None)
            Item(Global): Report Size, data= [ 0x01 ] 1
            Item(Global): Logical Minimum, data= [ 0x00 ] 0
            Item(Global): Logical Maximum, data= [ 0x01 ] 1
            Item(Local ): Usage, data= [ 0x44 ] 68
                            Charging
            Item(Main  ): Input, data= [ 0xa2 ] 162
                            Data Variable Absolute No_Wrap Linear
                            No_Preferred_State No_Null_Position Volatile Bitfield
            Item(Local ): Usage, data= [ 0x44 ] 68
                            Charging
            Item(Main  ): Feature, data= [ 0xa2 ] 162
                            Data Variable Absolute No_Wrap Linear
                            No_Preferred_State No_Null_Position Volatile Bitfield
            Item(Local ): Usage, data= [ 0x45 ] 69
                            Discharging
            Item(Main  ): Input, data= [ 0xa2 ] 162
                            Data Variable Absolute No_Wrap Linear
                            No_Preferred_State No_Null_Position Volatile Bitfield
            Item(Local ): Usage, data= [ 0x45 ] 69
                            Discharging
            Item(Main  ): Feature, data= [ 0xa2 ] 162
                            Data Variable Absolute No_Wrap Linear
                            No_Preferred_State No_Null_Position Volatile Bitfield
            Item(Local ): Usage, data= [ 0xd0 ] 208
                            AC Present
            Item(Main  ): Input, data= [ 0xa2 ] 162
                            Data Variable Absolute No_Wrap Linear
                            No_Preferred_State No_Null_Position Volatile Bitfield
            Item(Local ): Usage, data= [ 0xd0 ] 208
                            AC Present
            Item(Main  ): Feature, data= [ 0xa2 ] 162
                            Data Variable Absolute No_Wrap Linear
                            No_Preferred_State No_Null_Position Volatile Bitfield
            Item(Local ): Usage, data= [ 0xd1 ] 209
                            Battery Present
            Item(Main  ): Input, data= [ 0xa2 ] 162
                            Data Variable Absolute No_Wrap Linear
                            No_Preferred_State No_Null_Position Volatile Bitfield
            Item(Local ): Usage, data= [ 0xd1 ] 209
                            Battery Present
            Item(Main  ): Feature, data= [ 0xa2 ] 162
                            Data Variable Absolute No_Wrap Linear
                            No_Preferred_State No_Null_Position Volatile Bitfield
            Item(Local ): Usage, data= [ 0x42 ] 66
                            Below Remaining Capacity Limit
            Item(Main  ): Input, data= [ 0xa2 ] 162
                            Data Variable Absolute No_Wrap Linear
                            No_Preferred_State No_Null_Position Volatile Bitfield
            Item(Local ): Usage, data= [ 0x42 ] 66
                            Below Remaining Capacity Limit
            Item(Main  ): Feature, data= [ 0xa2 ] 162
                            Data Variable Absolute No_Wrap Linear
                            No_Preferred_State No_Null_Position Volatile Bitfield
            Item(Global): Usage Page, data= [ 0x84 ] 132
                            Power Device Page
            Item(Local ): Usage, data= [ 0x69 ] 105
                            Shutdown  Imminent
            Item(Main  ): Input, data= [ 0xa2 ] 162
                            Data Variable Absolute No_Wrap Linear
                            No_Preferred_State No_Null_Position Volatile Bitfield
            Item(Local ): Usage, data= [ 0x69 ] 105
                            Shutdown  Imminent
            Item(Main  ): Feature, data= [ 0xa2 ] 162
                            Data Variable Absolute No_Wrap Linear
                            No_Preferred_State No_Null_Position Volatile Bitfield
            Item(Global): Usage Page, data= [ 0x85 ] 133
                            Battery System Page
            Item(Local ): Usage, data= [ 0x43 ] 67
                            Remaining Time Limit Expired
            Item(Main  ): Input, data= [ 0xa2 ] 162
                            Data Variable Absolute No_Wrap Linear
                            No_Preferred_State No_Null_Position Volatile Bitfield
            Item(Local ): Usage, data= [ 0x43 ] 67
                            Remaining Time Limit Expired
            Item(Main  ): Feature, data= [ 0xa2 ] 162
                            Data Variable Absolute No_Wrap Linear
                            No_Preferred_State No_Null_Position Volatile Bitfield
            Item(Global): Usage Page, data= [ 0x84 ] 132
                            Power Device Page
            Item(Local ): Usage, data= [ 0x73 ] 115
                            Communication Lost
            Item(Main  ): Input, data= [ 0xa2 ] 162
                            Data Variable Absolute No_Wrap Linear
                            No_Preferred_State No_Null_Position Volatile Bitfield
            Item(Local ): Usage, data= [ 0x73 ] 115
                            Communication Lost
            Item(Main  ): Feature, data= [ 0xa2 ] 162
                            Data Variable Absolute No_Wrap Linear
                            No_Preferred_State No_Null_Position Volatile Bitfield
            Item(Global): Usage Page, data= [ 0x85 ] 133
                            Battery System Page
            Item(Local ): Usage, data= [ 0x4b ] 75
                            Need Replacement
            Item(Main  ): Input, data= [ 0xa2 ] 162
                            Data Variable Absolute No_Wrap Linear
                            No_Preferred_State No_Null_Position Volatile Bitfield
            Item(Local ): Usage, data= [ 0x4b ] 75
                            Need Replacement
            Item(Main  ): Feature, data= [ 0xa2 ] 162
                            Data Variable Absolute No_Wrap Linear
                            No_Preferred_State No_Null_Position Volatile Bitfield
            Item(Global): Usage Page, data= [ 0x84 ] 132
                            Power Device Page
            Item(Local ): Usage, data= [ 0x65 ] 101
                            Overload
            Item(Main  ): Input, data= [ 0xa2 ] 162
                            Data Variable Absolute No_Wrap Linear
                            No_Preferred_State No_Null_Position Volatile Bitfield
            Item(Local ): Usage, data= [ 0x65 ] 101
                            Overload
            Item(Main  ): Feature, data= [ 0xa2 ] 162
                            Data Variable Absolute No_Wrap Linear
                            No_Preferred_State No_Null_Position Volatile Bitfield
            Item(Global): Usage Page, data= [ 0x85 ] 133
                            Battery System Page
            Item(Local ): Usage, data= [ 0xdb ] 219
                            Voltage Not Regulated
            Item(Main  ): Input, data= [ 0xa2 ] 162
                            Data Variable Absolute No_Wrap Linear
                            No_Preferred_State No_Null_Position Volatile Bitfield
            Item(Local ): Usage, data= [ 0xdb ] 219
                            Voltage Not Regulated
            Item(Main  ): Feature, data= [ 0xa2 ] 162
                            Data Variable Absolute No_Wrap Linear
                            No_Preferred_State No_Null_Position Volatile Bitfield
            Item(Global): Report Count, data= [ 0x15 ] 21
            Item(Main  ): Input, data= [ 0x01 ] 1
                            Constant Array Absolute No_Wrap Linear
                            Preferred_State No_Null_Position Non_Volatile Bitfield
            Item(Main  ): Feature, data= [ 0x01 ] 1
                            Constant Array Absolute No_Wrap Linear
                            Preferred_State No_Null_Position Non_Volatile Bitfield
            Item(Main  ): End Collection, data=none
            Item(Global): Report ID, data= [ 0x17 ] 23
            Item(Local ): Usage, data= [ 0x2a ] 42
                            Remaining Time Limit
            Item(Global): Report Count, data= [ 0x01 ] 1
            Item(Global): Report Size, data= [ 0x10 ] 16
            Item(Global): Logical Maximum, data= [ 0xff 0xff 0x00 0x00 ] 65535
            Item(Global): Unit, data= [ 0x01 0x10 ] 4097
                            System: SI Linear, Unit: Seconds
            Item(Main  ): Feature, data= [ 0xa2 ] 162
                            Data Variable Absolute No_Wrap Linear
                            No_Preferred_State No_Null_Position Volatile Bitfield
            Item(Global): Report ID, data= [ 0x18 ] 24
            Item(Global): Usage Page, data= [ 0x84 ] 132
                            Power Device Page
            Item(Local ): Usage, data= [ 0x5a ] 90
                            Audible Alarm Control
            Item(Global): Report Size, data= [ 0x08 ] 8
            Item(Global): Logical Minimum, data= [ 0x01 ] 1
            Item(Global): Logical Maximum, data= [ 0x03 ] 3
            Item(Global): Unit, data= [ 0x00 ] 0
                            System: None, Unit: (None)
            Item(Main  ): Feature, data= [ 0xa2 ] 162
                            Data Variable Absolute No_Wrap Linear
                            No_Preferred_State No_Null_Position Volatile Bitfield
            Item(Main  ): End Collection, data=none
            Item(Local ): Usage, data= [ 0x12 ] 18
                            Battery
            Item(Main  ): Collection, data= [ 0x00 ] 0
                            Physical
            Item(Global): Report ID, data= [ 0x1c ] 28
            Item(Global): Usage Page, data= [ 0x86 0xff ] 65414
                            (null)
            Item(Local ): Usage, data= [ 0x16 ] 22
                            (null)
            Item(Global): Report Size, data= [ 0x18 ] 24
            Item(Global): Logical Minimum, data= [ 0x00 ] 0
            Item(Global): Logical Maximum, data= [ 0xff 0xff 0xff 0x00 ] 16777215
            Item(Main  ): Feature, data= [ 0xa2 0x01 ] 418
                            Data Variable Absolute No_Wrap Linear
                            No_Preferred_State No_Null_Position Volatile Buffered Bytes
            Item(Global): Report ID, data= [ 0x20 ] 32
            Item(Global): Usage Page, data= [ 0x85 ] 133
                            Battery System Page
            Item(Local ): Usage, data= [ 0x85 ] 133
                            Manufacturer Date
            Item(Global): Report Size, data= [ 0x10 ] 16
            Item(Global): Logical Maximum, data= [ 0xff 0xff 0x00 0x00 ] 65535
            Item(Main  ): Feature, data= [ 0xa2 ] 162
                            Data Variable Absolute No_Wrap Linear
                            No_Preferred_State No_Null_Position Volatile Bitfield
            Item(Global): Report ID, data= [ 0x21 ] 33
            Item(Global): Usage Page, data= [ 0x84 ] 132
                            Power Device Page
            Item(Local ): Usage, data= [ 0x58 ] 88
                            Test
            Item(Global): Report Size, data= [ 0x08 ] 8
            Item(Global): Logical Maximum, data= [ 0x06 ] 6
            Item(Main  ): Input, data= [ 0xa2 ] 162
                            Data Variable Absolute No_Wrap Linear
                            No_Preferred_State No_Null_Position Volatile Bitfield
            Item(Local ): Usage, data= [ 0x58 ] 88
                            Test
            Item(Main  ): Feature, data= [ 0xa2 ] 162
                            Data Variable Absolute No_Wrap Linear
                            No_Preferred_State No_Null_Position Volatile Bitfield
            Item(Global): Report ID, data= [ 0x22 ] 34
            Item(Global): Usage Page, data= [ 0x85 ] 133
                            Battery System Page
            Item(Local ): Usage, data= [ 0x66 ] 102
                            Remaining Capacity
            Item(Global): Report Size, data= [ 0x08 ] 8
            Item(Global): Logical Maximum, data= [ 0x64 ] 100
            Item(Main  ): Feature, data= [ 0xa2 ] 162
                            Data Variable Absolute No_Wrap Linear
                            No_Preferred_State No_Null_Position Volatile Bitfield
            Item(Global): Report ID, data= [ 0x23 ] 35
            Item(Local ): Usage, data= [ 0x68 ] 104
                            Run Time To Empty
            Item(Global): Report Size, data= [ 0x10 ] 16
            Item(Global): Logical Maximum, data= [ 0xff 0xff 0x00 0x00 ] 65535
            Item(Global): Unit, data= [ 0x01 0x10 ] 4097
                            System: SI Linear, Unit: Seconds
            Item(Main  ): Feature, data= [ 0xa2 ] 162
                            Data Variable Absolute No_Wrap Linear
                            No_Preferred_State No_Null_Position Volatile Bitfield
            Item(Global): Report ID, data= [ 0x24 ] 36
            Item(Local ): Usage, data= [ 0x2a ] 42
                            Remaining Time Limit
            Item(Main  ): Feature, data= [ 0xa2 ] 162
                            Data Variable Absolute No_Wrap Linear
                            No_Preferred_State No_Null_Position Volatile Bitfield
            Item(Global): Report ID, data= [ 0x25 ] 37
            Item(Global): Usage Page, data= [ 0x84 ] 132
                            Power Device Page
            Item(Local ): Usage, data= [ 0x40 ] 64
                            Config Voltage
            Item(Global): Unit, data= [ 0x21 0xd1 0xf0 0x00 ] 15782177
                            System: SI Linear, Unit: Centimeter^2*Gram*Seconds^-3*Ampere^-1
            Item(Global): Unit Exponent, data= [ 0x05 ] 5
                            Unit Exponent: 5
            Item(Main  ): Feature, data= [ 0x22 ] 34
                            Data Variable Absolute No_Wrap Linear
                            No_Preferred_State No_Null_Position Non_Volatile Bitfield
            Item(Global): Report ID, data= [ 0x26 ] 38
            Item(Local ): Usage, data= [ 0x30 ] 48
                            Voltage
            Item(Main  ): Feature, data= [ 0xa2 ] 162
                            Data Variable Absolute No_Wrap Linear
                            No_Preferred_State No_Null_Position Volatile Bitfield
            Item(Global): Report ID, data= [ 0x27 ] 39
            Item(Global): Usage Page, data= [ 0x86 0xff ] 65414
                            (null)
            Item(Local ): Usage, data= [ 0x24 ] 36
                            (null)
            Item(Global): Report Size, data= [ 0x08 ] 8
            Item(Global): Logical Minimum, data= [ 0xe5 0x00 ] 229
            Item(Global): Logical Maximum, data= [ 0xfe 0x00 ] 254
            Item(Global): Unit, data= [ 0x00 ] 0
                            System: None, Unit: (None)
            Item(Global): Unit Exponent, data= [ 0x00 ] 0
                            Unit Exponent: 0
            Item(Main  ): Feature, data= [ 0xa2 ] 162
                            Data Variable Absolute No_Wrap Linear
                            No_Preferred_State No_Null_Position Volatile Bitfield
            Item(Global): Report ID, data= [ 0x28 ] 40
            Item(Local ): Usage, data= [ 0x18 ] 24
                            (null)
            Item(Global): Report Size, data= [ 0x20 ] 32
            Item(Global): Logical Minimum, data= [ 0x01 0x00 0x00 0x80 ] -2147483647
            Item(Global): Logical Maximum, data= [ 0xff 0xff 0xff 0x7f ] 2147483647
            Item(Main  ): Feature, data= [ 0xa2 0x01 ] 418
                            Data Variable Absolute No_Wrap Linear
                            No_Preferred_State No_Null_Position Volatile Buffered Bytes
            Item(Main  ): End Collection, data=none
            Item(Global): Usage Page, data= [ 0x84 ] 132
                            Power Device Page
            Item(Local ): Usage, data= [ 0x1a ] 26
                            Input
            Item(Main  ): Collection, data= [ 0x00 ] 0
                            Physical
            Item(Global): Report ID, data= [ 0x30 ] 48
            Item(Global): Usage Page, data= [ 0x84 ] 132
                            Power Device Page
            Item(Local ): Usage, data= [ 0x40 ] 64
                            Config Voltage
            Item(Global): Report Size, data= [ 0x10 ] 16
            Item(Global): Logical Minimum, data= [ 0x8c 0x00 ] 140
            Item(Global): Logical Maximum, data= [ 0x2c 0x01 ] 300
            Item(Global): Unit, data= [ 0x21 0xd1 0xf0 0x00 ] 15782177
                            System: SI Linear, Unit: Centimeter^2*Gram*Seconds^-3*Ampere^-1
            Item(Global): Unit Exponent, data= [ 0x07 ] 7
                            Unit Exponent: 7
            Item(Main  ): Feature, data= [ 0xa2 ] 162
                            Data Variable Absolute No_Wrap Linear
                            No_Preferred_State No_Null_Position Volatile Bitfield
            Item(Global): Report ID, data= [ 0x31 ] 49
            Item(Local ): Usage, data= [ 0x30 ] 48
                            Voltage
            Item(Global): Report Size, data= [ 0x10 ] 16
            Item(Main  ): Feature, data= [ 0xa2 ] 162
                            Data Variable Absolute No_Wrap Linear
                            No_Preferred_State No_Null_Position Volatile Bitfield
            Item(Global): Report ID, data= [ 0x32 ] 50
            Item(Local ): Usage, data= [ 0x53 ] 83
                            Low Voltage Transfer
            Item(Global): Logical Minimum, data= [ 0x8c 0x00 ] 140
            Item(Global): Logical Maximum, data= [ 0x96 0x00 ] 150
            Item(Main  ): Feature, data= [ 0xa2 ] 162
                            Data Variable Absolute No_Wrap Linear
                            No_Preferred_State No_Null_Position Volatile Bitfield
            Item(Global): Report ID, data= [ 0x33 ] 51
            Item(Local ): Usage, data= [ 0x54 ] 84
                            High Voltage Transfer
            Item(Global): Logical Minimum, data= [ 0x22 0x01 ] 290
            Item(Global): Logical Maximum, data= [ 0x2c 0x01 ] 300
            Item(Main  ): Feature, data= [ 0xa2 ] 162
                            Data Variable Absolute No_Wrap Linear
                            No_Preferred_State No_Null_Position Volatile Bitfield
            Item(Global): Report ID, data= [ 0x34 ] 52
            Item(Global): Usage Page, data= [ 0x86 0xff ] 65414
                            (null)
            Item(Local ): Usage, data= [ 0x24 ] 36
                            (null)
            Item(Global): Report Size, data= [ 0x08 ] 8
            Item(Global): Logical Minimum, data= [ 0x73 ] 115
            Item(Global): Logical Maximum, data= [ 0x8d 0x00 ] 141
            Item(Global): Unit, data= [ 0x00 ] 0
                            System: None, Unit: (None)
            Item(Global): Unit Exponent, data= [ 0x00 ] 0
                            Unit Exponent: 0
            Item(Main  ): Feature, data= [ 0xa2 ] 162
                            Data Variable Absolute No_Wrap Linear
                            No_Preferred_State No_Null_Position Volatile Bitfield
            Item(Global): Report ID, data= [ 0x35 ] 53
            Item(Local ): Usage, data= [ 0x61 ] 97
                            (null)
            Item(Global): Logical Minimum, data= [ 0x00 ] 0
            Item(Global): Logical Maximum, data= [ 0x02 ] 2
            Item(Main  ): Feature, data= [ 0xa2 ] 162
                            Data Variable Absolute No_Wrap Linear
                            No_Preferred_State No_Null_Position Volatile Bitfield
            Item(Global): Report ID, data= [ 0x36 ] 54
            Item(Local ): Usage, data= [ 0x52 ] 82
                            (null)
            Item(Global): Logical Maximum, data= [ 0x0d ] 13
            Item(Main  ): Feature, data= [ 0xa2 ] 162
                            Data Variable Absolute No_Wrap Linear
                            No_Preferred_State No_Null_Position Volatile Bitfield
            Item(Main  ): End Collection, data=none
            Item(Local ): Usage, data= [ 0x05 ] 5
                            (null)
            Item(Main  ): Collection, data= [ 0x00 ] 0
                            Physical
            Item(Global): Report ID, data= [ 0x40 ] 64
            Item(Local ): Usage, data= [ 0x7c ] 124
                            (null)
            Item(Global): Logical Maximum, data= [ 0x01 ] 1
            Item(Main  ): Feature, data= [ 0xa2 ] 162
                            Data Variable Absolute No_Wrap Linear
                            No_Preferred_State No_Null_Position Volatile Bitfield
            Item(Global): Report ID, data= [ 0x41 ] 65
            Item(Local ): Usage, data= [ 0x7d ] 125
                            (null)
            Item(Global): Report Size, data= [ 0x10 ] 16
            Item(Global): Logical Minimum, data= [ 0xff 0xff ] 65535
            Item(Global): Logical Maximum, data= [ 0xff 0x7f ] 32767
            Item(Global): Unit, data= [ 0x01 0x10 ] 4097
                            System: SI Linear, Unit: Seconds
            Item(Main  ): Feature, data= [ 0xa2 ] 162
                            Data Variable Absolute No_Wrap Linear
                            No_Preferred_State No_Null_Position Volatile Bitfield
            Item(Global): Report ID, data= [ 0x42 ] 66
            Item(Global): Usage Page, data= [ 0x84 ] 132
                            Power Device Page
            Item(Local ): Usage, data= [ 0x57 ] 87
                            Delay Before Shutdown
            Item(Main  ): Feature, data= [ 0xa2 ] 162
                            Data Variable Absolute No_Wrap Linear
                            No_Preferred_State No_Null_Position Volatile Bitfield
            Item(Main  ): End Collection, data=none
            Item(Local ): Usage, data= [ 0x16 ] 22
                            Power Converter
            Item(Main  ): Collection, data= [ 0x00 ] 0
                            Physical
            Item(Global): Report ID, data= [ 0x50 ] 80
            Item(Local ): Usage, data= [ 0x35 ] 53
                            Percent Load
            Item(Global): Report Size, data= [ 0x08 ] 8
            Item(Global): Logical Minimum, data= [ 0x00 ] 0
            Item(Global): Logical Maximum, data= [ 0x64 ] 100
            Item(Global): Unit, data= [ 0x00 ] 0
                            System: None, Unit: (None)
            Item(Main  ): Feature, data= [ 0xa2 ] 162
                            Data Variable Absolute No_Wrap Linear
                            No_Preferred_State No_Null_Position Volatile Bitfield
            Item(Global): Report ID, data= [ 0x51 ] 81
            Item(Global): Usage Page, data= [ 0x86 0xff ] 65414
                            (null)
            Item(Local ): Usage, data= [ 0x24 ] 36
                            (null)
            Item(Global): Logical Minimum, data= [ 0x73 ] 115
            Item(Global): Logical Maximum, data= [ 0x8d 0x00 ] 141
            Item(Main  ): Feature, data= [ 0xa2 ] 162
                            Data Variable Absolute No_Wrap Linear
                            No_Preferred_State No_Null_Position Volatile Bitfield
            Item(Global): Report Size, data= [ 0x10 ] 16
            Item(Global): Logical Minimum, data= [ 0x00 ] 0
            Item(Global): Logical Maximum, data= [ 0xff 0xff 0x00 0x00 ] 65535
            Item(Global): Unit, data= [ 0x21 0xd1 ] 53537
                            System: SI Linear, Unit: Centimeter^2*Gram*Seconds^-3
            Item(Global): Unit Exponent, data= [ 0x07 ] 7
                            Unit Exponent: 7
            Item(Global): Report ID, data= [ 0x52 ] 82
            Item(Global): Usage Page, data= [ 0x84 ] 132
                            Power Device Page
            Item(Local ): Usage, data= [ 0x44 ] 68
                            Config Active Power
            Item(Main  ): Feature, data= [ 0xa2 ] 162
                            Data Variable Absolute No_Wrap Linear
                            No_Preferred_State No_Null_Position Volatile Bitfield
            Item(Main  ): End Collection, data=none
            Item(Global): Usage Page, data= [ 0x86 0xff ] 65414
                            (null)
            Item(Local ): Usage, data= [ 0x01 ] 1
                            (null)
            Item(Main  ): Collection, data= [ 0x00 ] 0
                            Physical
            Item(Global): Report ID, data= [ 0x60 ] 96
            Item(Local ): Usage, data= [ 0x23 ] 35
                            (null)
            Item(Global): Unit, data= [ 0x00 ] 0
                            System: None, Unit: (None)
            Item(Global): Unit Exponent, data= [ 0x00 ] 0
                            Unit Exponent: 0
            Item(Main  ): Feature, data= [ 0xa2 ] 162
                            Data Variable Absolute No_Wrap Linear
                            No_Preferred_State No_Null_Position Volatile Bitfield
            Item(Global): Report ID, data= [ 0x61 ] 97
            Item(Local ): Usage, data= [ 0x26 ] 38
                            (null)
            Item(Global): Report Size, data= [ 0x08 ] 8
            Item(Global): Logical Minimum, data= [ 0x8a 0x00 ] 138
            Item(Global): Logical Maximum, data= [ 0x8a 0x00 ] 138
            Item(Main  ): Feature, data= [ 0xa2 ] 162
                            Data Variable Absolute No_Wrap Linear
                            No_Preferred_State No_Null_Position Volatile Bitfield
            Item(Global): Report ID, data= [ 0x62 ] 98
            Item(Local ): Usage, data= [ 0x25 ] 37
                            (null)
            Item(Global): Report Size, data= [ 0x20 ] 32
            Item(Global): Logical Minimum, data= [ 0x01 0x00 0x00 0x80 ] -2147483647
            Item(Global): Logical Maximum, data= [ 0xff 0xff 0xff 0x7f ] 2147483647
            Item(Main  ): Feature, data= [ 0xa2 0x01 ] 418
                            Data Variable Absolute No_Wrap Linear
                            No_Preferred_State No_Null_Position Volatile Buffered Bytes
            Item(Main  ): End Collection, data=none
            Item(Global): Report ID, data= [ 0x7f ] 127
            Item(Global): Usage Page, data= [ 0x84 ] 132
                            Power Device Page
            Item(Local ): Usage, data= [ 0xfe ] 254
                            iProduct
            Item(Local ): String Index, data= [ 0x05 ] 5
            Item(Global): Report Size, data= [ 0x08 ] 8
            Item(Global): Report Count, data= [ 0x01 ] 1
            Item(Global): Logical Minimum, data= [ 0x00 ] 0
            Item(Global): Logical Maximum, data= [ 0xff 0x00 ] 255
            Item(Main  ): Feature, data= [ 0x22 ] 34
                            Data Variable Absolute No_Wrap Linear
                            No_Preferred_State No_Null_Position Non_Volatile Bitfield
            Item(Global): Report ID, data= [ 0x7e ] 126
            Item(Global): Usage Page, data= [ 0x86 0xff ] 65414
                            (null)
            Item(Local ): Usage, data= [ 0x42 ] 66
                            (null)
            Item(Local ): String Index, data= [ 0x06 ] 6
            Item(Main  ): Feature, data= [ 0x22 ] 34
                            Data Variable Absolute No_Wrap Linear
                            No_Preferred_State No_Null_Position Non_Volatile Bitfield
            Item(Global): Report ID, data= [ 0x7d ] 125
            Item(Global): Usage Page, data= [ 0x84 ] 132
                            Power Device Page
            Item(Local ): Usage, data= [ 0xff ] 255
                            iSerialNumber
            Item(Local ): String Index, data= [ 0x02 ] 2
            Item(Main  ): Feature, data= [ 0x22 ] 34
                            Data Variable Absolute No_Wrap Linear
                            No_Preferred_State No_Null_Position Non_Volatile Bitfield
            Item(Global): Report ID, data= [ 0x7c ] 124
            Item(Local ): Usage, data= [ 0xfd ] 253
                            iManufacturer
            Item(Local ): String Index, data= [ 0x03 ] 3
            Item(Main  ): Feature, data= [ 0x22 ] 34
                            Data Variable Absolute No_Wrap Linear
                            No_Preferred_State No_Null_Position Non_Volatile Bitfield
            Item(Global): Report ID, data= [ 0x7b ] 123
            Item(Global): Usage Page, data= [ 0x85 ] 133
                            Battery System Page
            Item(Local ): Usage, data= [ 0x85 ] 133
                            Manufacturer Date
            Item(Global): Report Size, data= [ 0x10 ] 16
            Item(Global): Logical Maximum, data= [ 0xff 0xff 0x00 0x00 ] 65535
            Item(Main  ): Feature, data= [ 0xa2 ] 162
                            Data Variable Absolute No_Wrap Linear
                            No_Preferred_State No_Null_Position Volatile Bitfield
            Item(Global): Usage Page, data= [ 0x84 ] 132
                            Power Device Page
            Item(Local ): Usage, data= [ 0x02 ] 2
                            Present Status
            Item(Main  ): Collection, data= [ 0x02 ] 2
                            Logical
            Item(Global): Report ID, data= [ 0x7a ] 122
            Item(Global): Usage Page, data= [ 0x85 ] 133
                            Battery System Page
            Item(Local ): Usage, data= [ 0x44 ] 68
                            Charging
            Item(Global): Report Size, data= [ 0x01 ] 1
            Item(Global): Logical Maximum, data= [ 0x01 ] 1
            Item(Main  ): Feature, data= [ 0xa2 ] 162
                            Data Variable Absolute No_Wrap Linear
                            No_Preferred_State No_Null_Position Volatile Bitfield
            Item(Local ): Usage, data= [ 0x45 ] 69
                            Discharging
            Item(Main  ): Feature, data= [ 0xa2 ] 162
                            Data Variable Absolute No_Wrap Linear
                            No_Preferred_State No_Null_Position Volatile Bitfield
            Item(Local ): Usage, data= [ 0xd0 ] 208
                            AC Present
            Item(Main  ): Feature, data= [ 0xa2 ] 162
                            Data Variable Absolute No_Wrap Linear
                            No_Preferred_State No_Null_Position Volatile Bitfield
            Item(Local ): Usage, data= [ 0xd1 ] 209
                            Battery Present
            Item(Main  ): Feature, data= [ 0xa2 ] 162
                            Data Variable Absolute No_Wrap Linear
                            No_Preferred_State No_Null_Position Volatile Bitfield
            Item(Local ): Usage, data= [ 0x42 ] 66
                            Below Remaining Capacity Limit
            Item(Main  ): Feature, data= [ 0xa2 ] 162
                            Data Variable Absolute No_Wrap Linear
                            No_Preferred_State No_Null_Position Volatile Bitfield
            Item(Global): Usage Page, data= [ 0x84 ] 132
                            Power Device Page
            Item(Local ): Usage, data= [ 0x69 ] 105
                            Shutdown  Imminent
            Item(Main  ): Feature, data= [ 0xa2 ] 162
                            Data Variable Absolute No_Wrap Linear
                            No_Preferred_State No_Null_Position Volatile Bitfield
            Item(Global): Usage Page, data= [ 0x85 ] 133
                            Battery System Page
            Item(Local ): Usage, data= [ 0x43 ] 67
                            Remaining Time Limit Expired
            Item(Main  ): Feature, data= [ 0xa2 ] 162
                            Data Variable Absolute No_Wrap Linear
                            No_Preferred_State No_Null_Position Volatile Bitfield
            Item(Global): Usage Page, data= [ 0x84 ] 132
                            Power Device Page
            Item(Local ): Usage, data= [ 0x73 ] 115
                            Communication Lost
            Item(Main  ): Feature, data= [ 0xa2 ] 162
                            Data Variable Absolute No_Wrap Linear
                            No_Preferred_State No_Null_Position Volatile Bitfield
            Item(Global): Usage Page, data= [ 0x85 ] 133
                            Battery System Page
            Item(Local ): Usage, data= [ 0x4b ] 75
                            Need Replacement
            Item(Main  ): Feature, data= [ 0xa2 ] 162
                            Data Variable Absolute No_Wrap Linear
                            No_Preferred_State No_Null_Position Volatile Bitfield
            Item(Global): Usage Page, data= [ 0x84 ] 132
                            Power Device Page
            Item(Local ): Usage, data= [ 0x65 ] 101
                            Overload
            Item(Main  ): Feature, data= [ 0xa2 ] 162
                            Data Variable Absolute No_Wrap Linear
                            No_Preferred_State No_Null_Position Volatile Bitfield
            Item(Global): Usage Page, data= [ 0x85 ] 133
                            Battery System Page
            Item(Local ): Usage, data= [ 0xdb ] 219
                            Voltage Not Regulated
            Item(Main  ): Feature, data= [ 0xa2 ] 162
                            Data Variable Absolute No_Wrap Linear
                            No_Preferred_State No_Null_Position Volatile Bitfield
            Item(Global): Report Count, data= [ 0x15 ] 21
            Item(Main  ): Feature, data= [ 0x01 ] 1
                            Constant Array Absolute No_Wrap Linear
                            Preferred_State No_Null_Position Non_Volatile Bitfield
            Item(Main  ): End Collection, data=none
            Item(Global): Report ID, data= [ 0x79 ] 121
            Item(Global): Usage Page, data= [ 0x86 0xff ] 65414
                            (null)
            Item(Local ): Usage, data= [ 0x72 ] 114
                            (null)
            Item(Global): Report Size, data= [ 0x08 ] 8
            Item(Global): Report Count, data= [ 0x01 ] 1
            Item(Main  ): Feature, data= [ 0xa2 ] 162
                            Data Variable Absolute No_Wrap Linear
                            No_Preferred_State No_Null_Position Volatile Bitfield
            Item(Global): Report ID, data= [ 0x78 ] 120
            Item(Global): Usage Page, data= [ 0x84 ] 132
                            Power Device Page
            Item(Local ): Usage, data= [ 0x5a ] 90
                            Audible Alarm Control
            Item(Global): Logical Minimum, data= [ 0x01 ] 1
            Item(Global): Logical Maximum, data= [ 0x03 ] 3
            Item(Main  ): Feature, data= [ 0xa2 ] 162
                            Data Variable Absolute No_Wrap Linear
                            No_Preferred_State No_Null_Position Volatile Bitfield
            Item(Global): Report ID, data= [ 0x75 ] 117
            Item(Global): Usage Page, data= [ 0x86 0xff ] 65414
                            (null)
            Item(Local ): Usage, data= [ 0x29 ] 41
                            (null)
            Item(Global): Report Size, data= [ 0x10 ] 16
            Item(Global): Logical Minimum, data= [ 0x00 ] 0
            Item(Global): Logical Maximum, data= [ 0xff 0xff 0x00 0x00 ] 65535
            Item(Main  ): Feature, data= [ 0xa2 ] 162
                            Data Variable Absolute No_Wrap Linear
                            No_Preferred_State No_Null_Position Volatile Bitfield
            Item(Global): Report ID, data= [ 0x74 ] 116
            Item(Global): Usage Page, data= [ 0x86 0xff ] 65414
                            (null)
            Item(Local ): Usage, data= [ 0x2a ] 42
                            (null)
            Item(Global): Report Size, data= [ 0x20 ] 32
            Item(Global): Logical Minimum, data= [ 0x01 0x00 0x00 0x80 ] -2147483647
            Item(Global): Logical Maximum, data= [ 0xff 0xff 0xff 0x7f ] 2147483647
            Item(Main  ): Feature, data= [ 0xa2 ] 162
                            Data Variable Absolute No_Wrap Linear
                            No_Preferred_State No_Null_Position Volatile Bitfield
            Item(Main  ): End Collection, data=none
      Endpoint Descriptor:
        bLength                 7
        bDescriptorType         5
        bEndpointAddress     0x81  EP 1 IN
        bmAttributes            3
          Transfer Type            Interrupt
          Synch Type               None
          Usage Type               Data
        wMaxPacketSize     0x0006  1x 6 bytes
        bInterval              10
Device Status:     0x0000
  (Bus Powered)
