
Bus 001 Device 001: ID 1d6b:0002 Linux Foundation 2.0 root hub
Device Descriptor:
  bLength                18
  bDescriptorType         1
  bcdUSB               2.00
  bDeviceClass            9 Hub
  bDeviceSubClass         0 [unknown]
  bDeviceProtocol         0 Full speed (or root) hub
  bMaxPacketSize0        64
  idVendor           0x1d6b Linux Foundation
  idProduct          0x0002 2.0 root hub
  bcdDevice            6.08
  iManufacturer           3 Linux 6.8.0-60-generic ehci_hcd
  iProduct                2 EHCI Host Controller
  iSerial                 1 0000:00:0b.0
  bNumConfigurations      1
  Configuration Descriptor:
    bLength                 9
    bDescriptorType         2
    wTotalLength       0x0019
    bNumInterfaces          1
    bConfigurationValue     1
    iConfiguration          0 
    bmAttributes         0xe0
      Self Powered
      Remote Wakeup
    MaxPower                0mA
    Interface Descriptor:
      bLength                 9
      bDescriptorType         4
      bInterfaceNumber        0
      bAlternateSetting       0
      bNumEndpoints           1
      bInterfaceClass         9 Hub
      bInterfaceSubClass      0 [unknown]
      bInterfaceProtocol      0 Full speed (or root) hub
      iInterface              0 
      Endpoint Descriptor:
        bLength                 7
        bDescriptorType         5
        bEndpointAddress     0x81  EP 1 IN
        bmAttributes            3
          Transfer Type            Interrupt
          Synch Type               None
          Usage Type               Data
        wMaxPacketSize     0x0004  1x 4 bytes
        bInterval              12
Hub Descriptor:
  bLength              11
  bDescriptorType      41
  nNbrPorts            12
  wHubCharacteristic 0x000a
    No power switching (usb 1.0)
    Per-port overcurrent protection
  bPwrOn2PwrGood       10 * 2 milli seconds
  bHubContrCurrent      0 milli Ampere
  DeviceRemovable    0x00 0x00
  PortPwrCtrlMask    0xff 0xff
 Hub Port Status:
   Port 1: 0000.0100 power
   Port 2: 0000.0100 power
   Port 3: 0000.0100 power
   Port 4: 0000.0100 power
   Port 5: 0000.0100 power
   Port 6: 0000.0100 power
   Port 7: 0000.0100 power
   Port 8: 0000.0100 power
   Port 9: 0000.0100 power
   Port 10: 0000.0100 power
   Port 11: 0000.0100 power
   Port 12: 0000.0100 power
Device Status:     0x0001
  Self Powered

Bus 002 Device 001: ID 1d6b:0001 Linux Foundation 1.1 root hub
Device Descriptor:
  bLength                18
  bDescriptorType         1
  bcdUSB               1.10
  bDeviceClass            9 Hub
  bDeviceSubClass         0 [unknown]
  bDeviceProtocol         0 Full speed (or root) hub
  bMaxPacketSize0        64
  idVendor           0x1d6b Linux Foundation
  idProduct          0x0001 1.1 root hub
  bcdDevice            6.08
  iManufacturer           3 Linux 6.8.0-60-generic ohci_hcd
  iProduct                2 OHCI PCI host controller
  iSerial                 1 0000:00:06.0
  bNumConfigurations      1
  Configuration Descriptor:
    bLength                 9
    bDescriptorType         2
    wTotalLength       0x0019
    bNumInterfaces          1
    bConfigurationValue     1
    iConfiguration          0 
    bmAttributes         0xe0
      Self Powered
      Remote Wakeup
    MaxPower                0mA
    Interface Descriptor:
      bLength                 9
      bDescriptorType         4
      bInterfaceNumber        0
      bAlternateSetting       0
      bNumEndpoints           1
      bInterfaceClass         9 Hub
      bInterfaceSubClass      0 [unknown]
      bInterfaceProtocol      0 Full speed (or root) hub
      iInterface              0 
      Endpoint Descriptor:
        bLength                 7
        bDescriptorType         5
        bEndpointAddress     0x81  EP 1 IN
        bmAttributes            3
          Transfer Type            Interrupt
          Synch Type               None
          Usage Type               Data
        wMaxPacketSize     0x0002  1x 2 bytes
        bInterval             255
Hub Descriptor:
  bLength              11
  bDescriptorType      41
  nNbrPorts            12
  wHubCharacteristic 0x000a
    No power switching (usb 1.0)
    Per-port overcurrent protection
  bPwrOn2PwrGood        0 * 2 milli seconds
  bHubContrCurrent      0 milli Ampere
  DeviceRemovable    0x00 0x00
  PortPwrCtrlMask    0xff 0xff
 Hub Port Status:
   Port 1: 0000.0103 power enable connect
   Port 2: 0000.0103 power enable connect
   Port 3: 0000.0100 power
   Port 4: 0000.0100 power
   Port 5: 0000.0100 power
   Port 6: 0000.0100 power
   Port 7: 0000.0100 power
   Port 8: 0000.0100 power
   Port 9: 0000.0100 power
   Port 10: 0000.0100 power
   Port 11: 0000.0100 power
   Port 12: 0000.0100 power
Device Status:     0x0001
  Self Powered

Bus 002 Device 002: ID 80ee:0021 VirtualBox USB Tablet
Device Descriptor:
  bLength                18
  bDescriptorType         1
  bcdUSB               1.10
  bDeviceClass            0 [unknown]
  bDeviceSubClass         0 [unknown]
  bDeviceProtocol         0 
  bMaxPacketSize0         8
  idVendor           0x80ee VirtualBox
  idProduct          0x0021 USB Tablet
  bcdDevice            1.00
  iManufacturer           1 VirtualBox
  iProduct                3 USB Tablet
  iSerial                 0 
  bNumConfigurations      1
  Configuration Descriptor:
    bLength                 9
    bDescriptorType         2
    wTotalLength       0x0022
    bNumInterfaces          1
    bConfigurationValue     1
    iConfiguration          0 
    bmAttributes         0x80
      (Bus Powered)
    MaxPower              100mA
    Interface Descriptor:
      bLength                 9
      bDescriptorType         4
      bInterfaceNumber        0
      bAlternateSetting       0
      bNumEndpoints           1
      bInterfaceClass         3 Human Interface Device
      bInterfaceSubClass      0 [unknown]
      bInterfaceProtocol      0 
      iInterface              0 
        HID Device Descriptor:
          bLength                 9
          bDescriptorType        33
          bcdHID               1.10
          bCountryCode            0 Not supported
          bNumDescriptors         1
          bDescriptorType        34 Report
          wDescriptorLength      85
          Report Descriptors: 
            ** UNAVAILABLE **
      Endpoint Descriptor:
        bLength                 7
        bDescriptorType         5
        bEndpointAddress     0x81  EP 1 IN
        bmAttributes            3
          Transfer Type            Interrupt
          Synch Type               None
          Usage Type               Data
        wMaxPacketSize     0x0008  1x 8 bytes
        bInterval              10
Device Status:     0x0000
  (Bus Powered)

Bus 002 Device 009: ID 051d:0002 American Power Conversion Uninterruptible Power Supply
Device Descriptor:
  bLength                18
  bDescriptorType         1
  bcdUSB               2.00
  bDeviceClass            0 [unknown]
  bDeviceSubClass         0 [unknown]
  bDeviceProtocol         0 
  bMaxPacketSize0        64
  idVendor           0x051d American Power Conversion
  idProduct          0x0002 Uninterruptible Power Supply
  bcdDevice            1.06
  iManufacturer           1 American Power Conversion
  iProduct                2 Back-UPS BX2200MI FW:378700G -302202G 
  iSerial                 3 9B2231A04007
  bNumConfigurations      1
  Configuration Descriptor:
    bLength                 9
    bDescriptorType         2
    wTotalLength       0x0022
    bNumInterfaces          1
    bConfigurationValue     1
    iConfiguration          0 
    bmAttributes         0x80
      (Bus Powered)
    MaxPower              100mA
    Interface Descriptor:
      bLength                 9
      bDescriptorType         4
      bInterfaceNumber        0
      bAlternateSetting       0
      bNumEndpoints           1
      bInterfaceClass         3 Human Interface Device
      bInterfaceSubClass      0 [unknown]
      bInterfaceProtocol      0 
      iInterface              0 
        HID Device Descriptor:
          bLength                 9
          bDescriptorType        33
          bcdHID               1.10
          bCountryCode           33 US
          bNumDescriptors         1
          bDescriptorType        34 Report
          wDescriptorLength     745
          Report Descriptor: (length is 745)
            Item(Global): Usage Page, data= [ 0x84 ] 132
                            Power Device Page
            Item(Local ): Usage, data= [ 0x04 ] 4
                            UPS
            Item(Main  ): Collection, data= [ 0x01 ] 1
                            Application
            Item(Local ): Usage, data= [ 0x24 ] 36
                            Power Summary
            Item(Main  ): Collection, data= [ 0x00 ] 0
                            Physical
            Item(Global): Report ID, data= [ 0x01 ] 1
            Item(Local ): Usage, data= [ 0xfe ] 254
                            iProduct
            Item(Local ): String Index, data= [ 0x02 ] 2
            Item(Global): Report Size, data= [ 0x08 ] 8
            Item(Global): Report Count, data= [ 0x01 ] 1
            Item(Global): Logical Minimum, data= [ 0x00 ] 0
            Item(Global): Logical Maximum, data= [ 0xff 0x00 ] 255
            Item(Main  ): Feature, data= [ 0x22 ] 34
                            Data Variable Absolute No_Wrap Linear
                            No_Preferred_State No_Null_Position Non_Volatile Bitfield
            Item(Global): Report ID, data= [ 0x02 ] 2
            Item(Local ): Usage, data= [ 0xff ] 255
                            iSerialNumber
            Item(Local ): String Index, data= [ 0x03 ] 3
            Item(Main  ): Feature, data= [ 0x22 ] 34
                            Data Variable Absolute No_Wrap Linear
                            No_Preferred_State No_Null_Position Non_Volatile Bitfield
            Item(Global): Report ID, data= [ 0x03 ] 3
            Item(Global): Usage Page, data= [ 0x85 ] 133
                            Battery System Page
            Item(Local ): Usage, data= [ 0x89 ] 137
                            iDeviceChemistry
            Item(Local ): String Index, data= [ 0x04 ] 4
            Item(Main  ): Feature, data= [ 0x22 ] 34
                            Data Variable Absolute No_Wrap Linear
                            No_Preferred_State No_Null_Position Non_Volatile Bitfield
            Item(Global): Report ID, data= [ 0x04 ] 4
            Item(Local ): Usage, data= [ 0x8f ] 143
                            iOEMInformation
            Item(Local ): String Index, data= [ 0x01 ] 1
            Item(Main  ): Feature, data= [ 0x22 ] 34
                            Data Variable Absolute No_Wrap Linear
                            No_Preferred_State No_Null_Position Non_Volatile Bitfield
            Item(Global): Report ID, data= [ 0x05 ] 5
            Item(Local ): Usage, data= [ 0x8b ] 139
                            Rechargeable
            Item(Main  ): Feature, data= [ 0x22 ] 34
                            Data Variable Absolute No_Wrap Linear
                            No_Preferred_State No_Null_Position Non_Volatile Bitfield
            Item(Global): Report ID, data= [ 0x0a ] 10
            Item(Global): Usage Page, data= [ 0x84 ] 132
                            Power Device Page
            Item(Local ): Usage, data= [ 0xfd ] 253
                            iManufacturer
            Item(Global): Report Size, data= [ 0x08 ] 8
            Item(Global): Logical Maximum, data= [ 0xff 0x00 ] 255
            Item(Global): Unit, data= [ 0x00 ] 0
                            System: None, Unit: (None)
            Item(Global): Unit Exponent, data= [ 0x00 ] 0
                            Unit Exponent: 0
            Item(Local ): String Index, data= [ 0x01 ] 1
            Item(Main  ): Feature, data= [ 0x22 ] 34
                            Data Variable Absolute No_Wrap Linear
                            No_Preferred_State No_Null_Position Non_Volatile Bitfield
            Item(Global): Report ID, data= [ 0x0b ] 11
            Item(Global): Usage Page, data= [ 0x85 ] 133
                            Battery System Page
            Item(Local ): Usage, data= [ 0x2c ] 44
                            Capacity Mode
            Item(Main  ): Feature, data= [ 0x03 ] 3
                            Constant Variable Absolute No_Wrap Linear
                            Preferred_State No_Null_Position Non_Volatile Bitfield
            Item(Global): Report Size, data= [ 0x08 ] 8
            Item(Global): Report ID, data= [ 0x0c ] 12
            Item(Local ): Usage, data= [ 0x66 ] 102
                            Remaining Capacity
            Item(Global): Logical Maximum, data= [ 0xff ] 255
            Item(Main  ): Feature, data= [ 0xa2 ] 162
                            Data Variable Absolute No_Wrap Linear
                            No_Preferred_State No_Null_Position Volatile Bitfield
            Item(Local ): Usage, data= [ 0x66 ] 102
                            Remaining Capacity
            Item(Main  ): Input, data= [ 0xa2 ] 162
                            Data Variable Absolute No_Wrap Linear
                            No_Preferred_State No_Null_Position Volatile Bitfield
            Item(Global): Report ID, data= [ 0x0d ] 13
            Item(Local ): Usage, data= [ 0x83 ] 131
                            Design Capacity
            Item(Global): Report Size, data= [ 0x08 ] 8
            Item(Global): Logical Maximum, data= [ 0x64 ] 100
            Item(Global): Unit, data= [ 0x00 ] 0
                            System: None, Unit: (None)
            Item(Main  ): Feature, data= [ 0x22 ] 34
                            Data Variable Absolute No_Wrap Linear
                            No_Preferred_State No_Null_Position Non_Volatile Bitfield
            Item(Global): Report ID, data= [ 0x0e ] 14
            Item(Local ): Usage, data= [ 0x67 ] 103
                            Full Charge Capacity
            Item(Main  ): Feature, data= [ 0x22 ] 34
                            Data Variable Absolute No_Wrap Linear
                            No_Preferred_State No_Null_Position Non_Volatile Bitfield
            Item(Global): Report ID, data= [ 0x0f ] 15
            Item(Local ): Usage, data= [ 0x68 ] 104
                            Run Time To Empty
            Item(Global): Report Size, data= [ 0x10 ] 16
            Item(Global): Logical Maximum, data= [ 0xff 0xff 0x00 0x00 ] 65535
            Item(Global): Unit, data= [ 0x01 0x10 ] 4097
                            System: SI Linear, Unit: Seconds
            Item(Main  ): Feature, data= [ 0xa2 ] 162
                            Data Variable Absolute No_Wrap Linear
                            No_Preferred_State No_Null_Position Volatile Bitfield
            Item(Global): Report ID, data= [ 0x11 ] 17
            Item(Global): Report Size, data= [ 0x08 ] 8
            Item(Global): Usage Page, data= [ 0x85 ] 133
                            Battery System Page
            Item(Local ): Usage, data= [ 0x29 ] 41
                            Remaining Capacity Limit
            Item(Global): Logical Minimum, data= [ 0x01 ] 1
            Item(Main  ): Feature, data= [ 0xa2 ] 162
                            Data Variable Absolute No_Wrap Linear
                            No_Preferred_State No_Null_Position Volatile Bitfield
            Item(Global): Report ID, data= [ 0x13 ] 19
            Item(Local ): Usage, data= [ 0xd0 ] 208
                            AC Present
            Item(Global): Logical Minimum, data= [ 0x00 ] 0
            Item(Global): Logical Maximum, data= [ 0x01 ] 1
            Item(Main  ): Input, data= [ 0xa2 ] 162
                            Data Variable Absolute No_Wrap Linear
                            No_Preferred_State No_Null_Position Volatile Bitfield
            Item(Local ): Usage, data= [ 0xd0 ] 208
                            AC Present
            Item(Main  ): Feature, data= [ 0xa2 ] 162
                            Data Variable Absolute No_Wrap Linear
                            No_Preferred_State No_Null_Position Volatile Bitfield
            Item(Global): Report ID, data= [ 0x14 ] 20
            Item(Local ): Usage, data= [ 0x42 ] 66
                            Below Remaining Capacity Limit
            Item(Main  ): Input, data= [ 0xa2 ] 162
                            Data Variable Absolute No_Wrap Linear
                            No_Preferred_State No_Null_Position Volatile Bitfield
            Item(Local ): Usage, data= [ 0x42 ] 66
                            Below Remaining Capacity Limit
            Item(Main  ): Feature, data= [ 0xa2 ] 162
                            Data Variable Absolute No_Wrap Linear
                            No_Preferred_State No_Null_Position Volatile Bitfield
            Item(Global): Report ID, data= [ 0x15 ] 21
            Item(Global): Usage Page, data= [ 0x84 ] 132
                            Power Device Page
            Item(Local ): Usage, data= [ 0x57 ] 87
                            Delay Before Shutdown
            Item(Global): Report Size, data= [ 0x10 ] 16
            Item(Global): Logical Minimum, data= [ 0xff 0xff ] 65535
            Item(Global): Logical Maximum, data= [ 0xff 0x7f ] 32767
            Item(Global): Unit, data= [ 0x01 0x10 ] 4097
                            System: SI Linear, Unit: Seconds
            Item(Main  ): Feature, data= [ 0xa2 ] 162
                            Data Variable Absolute No_Wrap Linear
                            No_Preferred_State No_Null_Position Volatile Bitfield
            Item(Global): Report ID, data= [ 0x17 ] 23
            Item(Global): Usage Page, data= [ 0x85 ] 133
                            Battery System Page
            Item(Local ): Usage, data= [ 0x2a ] 42
                            Remaining Time Limit
            Item(Global): Report Count, data= [ 0x01 ] 1
            Item(Global): Report Size, data= [ 0x10 ] 16
            Item(Global): Logical Maximum, data= [ 0xff 0xff 0x00 0x00 ] 65535
            Item(Global): Unit, data= [ 0x01 0x10 ] 4097
                            System: SI Linear, Unit: Seconds
            Item(Main  ): Feature, data= [ 0xa2 ] 162
                            Data Variable Absolute No_Wrap Linear
                            No_Preferred_State No_Null_Position Volatile Bitfield
            Item(Global): Report ID, data= [ 0x18 ] 24
            Item(Global): Usage Page, data= [ 0x84 ] 132
                            Power Device Page
            Item(Local ): Usage, data= [ 0x5a ] 90
                            Audible Alarm Control
            Item(Global): Report Size, data= [ 0x08 ] 8
            Item(Global): Logical Minimum, data= [ 0x01 ] 1
            Item(Global): Logical Maximum, data= [ 0x03 ] 3
            Item(Global): Unit, data= [ 0x00 ] 0
                            System: None, Unit: (None)
            Item(Main  ): Feature, data= [ 0xa2 ] 162
                            Data Variable Absolute No_Wrap Linear
                            No_Preferred_State No_Null_Position Volatile Bitfield
            Item(Local ): Usage, data= [ 0x02 ] 2
                            Present Status
            Item(Main  ): Collection, data= [ 0x02 ] 2
                            Logical
            Item(Global): Report ID, data= [ 0x16 ] 22
            Item(Global): Usage Page, data= [ 0x85 ] 133
                            Battery System Page
            Item(Global): Unit, data= [ 0x00 ] 0
                            System: None, Unit: (None)
            Item(Global): Report Size, data= [ 0x01 ] 1
            Item(Global): Logical Minimum, data= [ 0x00 ] 0
            Item(Global): Logical Maximum, data= [ 0x01 ] 1
            Item(Local ): Usage, data= [ 0x44 ] 68
                            Charging
            Item(Main  ): Input, data= [ 0xa2 ] 162
                            Data Variable Absolute No_Wrap Linear
                            No_Preferred_State No_Null_Position Volatile Bitfield
            Item(Local ): Usage, data= [ 0x44 ] 68
                            Charging
            Item(Main  ): Feature, data= [ 0xa2 ] 162
                            Data Variable Absolute No_Wrap Linear
                            No_Preferred_State No_Null_Position Volatile Bitfield
            Item(Local ): Usage, data= [ 0x45 ] 69
                            Discharging
            Item(Main  ): Input, data= [ 0xa2 ] 162
                            Data Variable Absolute No_Wrap Linear
                            No_Preferred_State No_Null_Position Volatile Bitfield
            Item(Local ): Usage, data= [ 0x45 ] 69
                            Discharging
            Item(Main  ): Feature, data= [ 0xa2 ] 162
                            Data Variable Absolute No_Wrap Linear
                            No_Preferred_State No_Null_Position Volatile Bitfield
            Item(Local ): Usage, data= [ 0xd0 ] 208
                            AC Present
            Item(Main  ): Input, data= [ 0xa2 ] 162
                            Data Variable Absolute No_Wrap Linear
                            No_Preferred_State No_Null_Position Volatile Bitfield
            Item(Local ): Usage, data= [ 0xd0 ] 208
                            AC Present
            Item(Main  ): Feature, data= [ 0xa2 ] 162
                            Data Variable Absolute No_Wrap Linear
                            No_Preferred_State No_Null_Position Volatile Bitfield
            Item(Local ): Usage, data= [ 0xd1 ] 209
                            Battery Present
            Item(Main  ): Input, data= [ 0xa2 ] 162
                            Data Variable Absolute No_Wrap Linear
                            No_Preferred_State No_Null_Position Volatile Bitfield
            Item(Local ): Usage, data= [ 0xd1 ] 209
                            Battery Present
            Item(Main  ): Feature, data= [ 0xa2 ] 162
                            Data Variable Absolute No_Wrap Linear
                            No_Preferred_State No_Null_Position Volatile Bitfield
            Item(Global): Usage Page, data= [ 0x84 ] 132
                            Power Device Page
            Item(Local ): Usage, data= [ 0x69 ] 105
                            Shutdown  Imminent
            Item(Main  ): Input, data= [ 0xa2 ] 162
                            Data Variable Absolute No_Wrap Linear
                            No_Preferred_State No_Null_Position Volatile Bitfield
            Item(Local ): Usage, data= [ 0x69 ] 105
                            Shutdown  Imminent
            Item(Main  ): Feature, data= [ 0xa2 ] 162
                            Data Variable Absolute No_Wrap Linear
                            No_Preferred_State No_Null_Position Volatile Bitfield
            Item(Global): Usage Page, data= [ 0x85 ] 133
                            Battery System Page
            Item(Local ): Usage, data= [ 0x43 ] 67
                            Remaining Time Limit Expired
            Item(Main  ): Input, data= [ 0xa2 ] 162
                            Data Variable Absolute No_Wrap Linear
                            No_Preferred_State No_Null_Position Volatile Bitfield
            Item(Local ): Usage, data= [ 0x43 ] 67
                            Remaining Time Limit Expired
            Item(Main  ): Feature, data= [ 0xa2 ] 162
                            Data Variable Absolute No_Wrap Linear
                            No_Preferred_State No_Null_Position Volatile Bitfield
            Item(Global): Usage Page, data= [ 0x85 ] 133
                            Battery System Page
            Item(Local ): Usage, data= [ 0x4b ] 75
                            Need Replacement
            Item(Main  ): Input, data= [ 0xa2 ] 162
                            Data Variable Absolute No_Wrap Linear
                            No_Preferred_State No_Null_Position Volatile Bitfield
            Item(Local ): Usage, data= [ 0x4b ] 75
                            Need Replacement
            Item(Main  ): Feature, data= [ 0xa2 ] 162
                            Data Variable Absolute No_Wrap Linear
                            No_Preferred_State No_Null_Position Volatile Bitfield
            Item(Global): Usage Page, data= [ 0x84 ] 132
                            Power Device Page
            Item(Local ): Usage, data= [ 0x65 ] 101
                            Overload
            Item(Main  ): Input, data= [ 0xa2 ] 162
                            Data Variable Absolute No_Wrap Linear
                            No_Preferred_State No_Null_Position Volatile Bitfield
            Item(Local ): Usage, data= [ 0x65 ] 101
                            Overload
            Item(Main  ): Feature, data= [ 0xa2 ] 162
                            Data Variable Absolute No_Wrap Linear
                            No_Preferred_State No_Null_Position Volatile Bitfield
            Item(Global): Usage Page, data= [ 0x85 ] 133
                            Battery System Page
            Item(Local ): Usage, data= [ 0xdb ] 219
                            Voltage Not Regulated
            Item(Main  ): Input, data= [ 0xa2 ] 162
                            Data Variable Absolute No_Wrap Linear
                            No_Preferred_State No_Null_Position Volatile Bitfield
            Item(Local ): Usage, data= [ 0xdb ] 219
                            Voltage Not Regulated
            Item(Main  ): Feature, data= [ 0xa2 ] 162
                            Data Variable Absolute No_Wrap Linear
                            No_Preferred_State No_Null_Position Volatile Bitfield
            Item(Global): Report Count, data= [ 0x17 ] 23
            Item(Main  ): Input, data= [ 0x01 ] 1
                            Constant Array Absolute No_Wrap Linear
                            Preferred_State No_Null_Position Non_Volatile Bitfield
            Item(Main  ): Feature, data= [ 0x01 ] 1
                            Constant Array Absolute No_Wrap Linear
                            Preferred_State No_Null_Position Non_Volatile Bitfield
            Item(Main  ): End Collection, data=none
            Item(Main  ): End Collection, data=none
            Item(Global): Usage Page, data= [ 0x84 ] 132
                            Power Device Page
            Item(Local ): Usage, data= [ 0x12 ] 18
                            Battery
            Item(Main  ): Collection, data= [ 0x00 ] 0
                            Physical
            Item(Global): Report Count, data= [ 0x01 ] 1
            Item(Global): Report ID, data= [ 0x20 ] 32
            Item(Global): Usage Page, data= [ 0x85 ] 133
                            Battery System Page
            Item(Local ): Usage, data= [ 0x85 ] 133
                            Manufacturer Date
            Item(Global): Report Size, data= [ 0x10 ] 16
            Item(Global): Logical Minimum, data= [ 0x00 ] 0
            Item(Global): Logical Maximum, data= [ 0xff 0xff 0x00 0x00 ] 65535
            Item(Main  ): Input, data= [ 0x22 ] 34
                            Data Variable Absolute No_Wrap Linear
                            No_Preferred_State No_Null_Position Non_Volatile Bitfield
            Item(Local ): Usage, data= [ 0x85 ] 133
                            Manufacturer Date
            Item(Main  ): Feature, data= [ 0xa2 ] 162
                            Data Variable Absolute No_Wrap Linear
                            No_Preferred_State No_Null_Position Volatile Bitfield
            Item(Global): Report ID, data= [ 0x21 ] 33
            Item(Global): Usage Page, data= [ 0x84 ] 132
                            Power Device Page
            Item(Local ): Usage, data= [ 0x58 ] 88
                            Test
            Item(Global): Report Size, data= [ 0x08 ] 8
            Item(Global): Logical Maximum, data= [ 0x06 ] 6
            Item(Main  ): Input, data= [ 0xa2 ] 162
                            Data Variable Absolute No_Wrap Linear
                            No_Preferred_State No_Null_Position Volatile Bitfield
            Item(Local ): Usage, data= [ 0x58 ] 88
                            Test
            Item(Main  ): Feature, data= [ 0xa2 ] 162
                            Data Variable Absolute No_Wrap Linear
                            No_Preferred_State No_Null_Position Volatile Bitfield
            Item(Global): Report ID, data= [ 0x22 ] 34
            Item(Global): Usage Page, data= [ 0x85 ] 133
                            Battery System Page
            Item(Local ): Usage, data= [ 0x66 ] 102
                            Remaining Capacity
            Item(Global): Logical Maximum, data= [ 0xff ] 255
            Item(Main  ): Feature, data= [ 0xa2 ] 162
                            Data Variable Absolute No_Wrap Linear
                            No_Preferred_State No_Null_Position Volatile Bitfield
            Item(Global): Report ID, data= [ 0x23 ] 35
            Item(Local ): Usage, data= [ 0x68 ] 104
                            Run Time To Empty
            Item(Global): Report Size, data= [ 0x10 ] 16
            Item(Global): Logical Maximum, data= [ 0xff 0xff 0x00 0x00 ] 65535
            Item(Global): Unit, data= [ 0x01 0x10 ] 4097
                            System: SI Linear, Unit: Seconds
            Item(Main  ): Feature, data= [ 0xa2 ] 162
                            Data Variable Absolute No_Wrap Linear
                            No_Preferred_State No_Null_Position Volatile Bitfield
            Item(Global): Report ID, data= [ 0x24 ] 36
            Item(Local ): Usage, data= [ 0x2a ] 42
                            Remaining Time Limit
            Item(Main  ): Feature, data= [ 0xa2 ] 162
                            Data Variable Absolute No_Wrap Linear
                            No_Preferred_State No_Null_Position Volatile Bitfield
            Item(Global): Report ID, data= [ 0x25 ] 37
            Item(Global): Usage Page, data= [ 0x84 ] 132
                            Power Device Page
            Item(Local ): Usage, data= [ 0x40 ] 64
                            Config Voltage
            Item(Global): Unit, data= [ 0x21 0xd1 0xf0 0x00 ] 15782177
                            System: SI Linear, Unit: Centimeter^2*Gram*Seconds^-3*Ampere^-1
            Item(Global): Unit Exponent, data= [ 0x05 ] 5
                            Unit Exponent: 5
            Item(Main  ): Feature, data= [ 0x22 ] 34
                            Data Variable Absolute No_Wrap Linear
                            No_Preferred_State No_Null_Position Non_Volatile Bitfield
            Item(Global): Report ID, data= [ 0x26 ] 38
            Item(Local ): Usage, data= [ 0x30 ] 48
                            Voltage
            Item(Main  ): Feature, data= [ 0xa2 ] 162
                            Data Variable Absolute No_Wrap Linear
                            No_Preferred_State No_Null_Position Volatile Bitfield
            Item(Main  ): End Collection, data=none
            Item(Global): Usage Page, data= [ 0x84 ] 132
                            Power Device Page
            Item(Local ): Usage, data= [ 0x1a ] 26
                            Input
            Item(Main  ): Collection, data= [ 0x00 ] 0
                            Physical
            Item(Global): Report ID, data= [ 0x30 ] 48
            Item(Global): Usage Page, data= [ 0x84 ] 132
                            Power Device Page
            Item(Local ): Usage, data= [ 0x40 ] 64
                            Config Voltage
            Item(Global): Report Size, data= [ 0x08 ] 8
            Item(Global): Logical Minimum, data= [ 0x00 ] 0
            Item(Global): Logical Maximum, data= [ 0xff 0x00 ] 255
            Item(Global): Unit, data= [ 0x21 0xd1 0xf0 0x00 ] 15782177
                            System: SI Linear, Unit: Centimeter^2*Gram*Seconds^-3*Ampere^-1
            Item(Global): Unit Exponent, data= [ 0x07 ] 7
                            Unit Exponent: 7
            Item(Main  ): Feature, data= [ 0x22 ] 34
                            Data Variable Absolute No_Wrap Linear
                            No_Preferred_State No_Null_Position Non_Volatile Bitfield
            Item(Global): Report ID, data= [ 0x31 ] 49
            Item(Local ): Usage, data= [ 0x30 ] 48
                            Voltage
            Item(Global): Report Size, data= [ 0x10 ] 16
            Item(Main  ): Feature, data= [ 0xa2 ] 162
                            Data Variable Absolute No_Wrap Linear
                            No_Preferred_State No_Null_Position Volatile Bitfield
            Item(Global): Report ID, data= [ 0x32 ] 50
            Item(Local ): Usage, data= [ 0x53 ] 83
                            Low Voltage Transfer
            Item(Global): Logical Minimum, data= [ 0x8c 0x00 ] 140
            Item(Global): Logical Maximum, data= [ 0x96 0x00 ] 150
            Item(Main  ): Feature, data= [ 0xa2 ] 162
                            Data Variable Absolute No_Wrap Linear
                            No_Preferred_State No_Null_Position Volatile Bitfield
            Item(Global): Report ID, data= [ 0x33 ] 51
            Item(Local ): Usage, data= [ 0x54 ] 84
                            High Voltage Transfer
            Item(Global): Logical Minimum, data= [ 0x22 0x01 ] 290
            Item(Global): Logical Maximum, data= [ 0x2c 0x01 ] 300
            Item(Main  ): Feature, data= [ 0xa2 ] 162
                            Data Variable Absolute No_Wrap Linear
                            No_Preferred_State No_Null_Position Volatile Bitfield
            Item(Global): Report ID, data= [ 0x35 ] 53
            Item(Global): Report Size, data= [ 0x08 ] 8
            Item(Global): Usage Page, data= [ 0x86 0xff ] 65414
                            (null)
            Item(Local ): Usage, data= [ 0x61 ] 97
                            (null)
            Item(Global): Logical Minimum, data= [ 0x00 ] 0
            Item(Global): Logical Maximum, data= [ 0x02 ] 2
            Item(Main  ): Feature, data= [ 0xa2 ] 162
                            Data Variable Absolute No_Wrap Linear
                            No_Preferred_State No_Null_Position Volatile Bitfield
            Item(Global): Report ID, data= [ 0x36 ] 54
            Item(Local ): Usage, data= [ 0x52 ] 82
                            (null)
            Item(Global): Logical Maximum, data= [ 0x0d ] 13
            Item(Main  ): Feature, data= [ 0xa2 ] 162
                            Data Variable Absolute No_Wrap Linear
                            No_Preferred_State No_Null_Position Volatile Bitfield
            Item(Main  ): End Collection, data=none
            Item(Local ): Usage, data= [ 0x05 ] 5
                            (null)
            Item(Main  ): Collection, data= [ 0x00 ] 0
                            Physical
            Item(Global): Report ID, data= [ 0x40 ] 64
            Item(Local ): Usage, data= [ 0x7c ] 124
                            (null)
            Item(Global): Logical Maximum, data= [ 0xff ] 255
            Item(Main  ): Feature, data= [ 0xa2 ] 162
                            Data Variable Absolute No_Wrap Linear
                            No_Preferred_State No_Null_Position Volatile Bitfield
            Item(Main  ): End Collection, data=none
            Item(Global): Usage Page, data= [ 0x84 ] 132
                            Power Device Page
            Item(Local ): Usage, data= [ 0x16 ] 22
                            Power Converter
            Item(Main  ): Collection, data= [ 0x00 ] 0
                            Physical
            Item(Global): Report ID, data= [ 0x50 ] 80
            Item(Local ): Usage, data= [ 0x35 ] 53
                            Percent Load
            Item(Global): Report Size, data= [ 0x08 ] 8
            Item(Global): Logical Minimum, data= [ 0x00 ] 0
            Item(Global): Logical Maximum, data= [ 0x64 ] 100
            Item(Global): Unit, data= [ 0x00 ] 0
                            System: None, Unit: (None)
            Item(Global): Unit Exponent, data= [ 0x00 ] 0
                            Unit Exponent: 0
            Item(Main  ): Feature, data= [ 0xa2 ] 162
                            Data Variable Absolute No_Wrap Linear
                            No_Preferred_State No_Null_Position Volatile Bitfield
            Item(Global): Report ID, data= [ 0x52 ] 82
            Item(Global): Usage Page, data= [ 0x84 ] 132
                            Power Device Page
            Item(Local ): Usage, data= [ 0x44 ] 68
                            Config Active Power
            Item(Global): Report Size, data= [ 0x10 ] 16
            Item(Global): Logical Minimum, data= [ 0x00 ] 0
            Item(Global): Logical Maximum, data= [ 0xff 0xff 0x00 0x00 ] 65535
            Item(Global): Unit, data= [ 0x21 0xd1 ] 53537
                            System: SI Linear, Unit: Centimeter^2*Gram*Seconds^-3
            Item(Global): Unit Exponent, data= [ 0x07 ] 7
                            Unit Exponent: 7
            Item(Main  ): Feature, data= [ 0xa2 ] 162
                            Data Variable Absolute No_Wrap Linear
                            No_Preferred_State No_Null_Position Volatile Bitfield
            Item(Main  ): End Collection, data=none
            Item(Global): Report ID, data= [ 0x7f ] 127
            Item(Global): Usage Page, data= [ 0x84 ] 132
                            Power Device Page
            Item(Local ): Usage, data= [ 0xfe ] 254
                            iProduct
            Item(Local ): String Index, data= [ 0x05 ] 5
            Item(Global): Report Size, data= [ 0x08 ] 8
            Item(Global): Report Count, data= [ 0x01 ] 1
            Item(Global): Logical Minimum, data= [ 0x00 ] 0
            Item(Global): Logical Maximum, data= [ 0xff 0x00 ] 255
            Item(Global): Unit, data= [ 0x00 ] 0
                            System: None, Unit: (None)
            Item(Global): Unit Exponent, data= [ 0x00 ] 0
                            Unit Exponent: 0
            Item(Main  ): Feature, data= [ 0x22 ] 34
                            Data Variable Absolute No_Wrap Linear
                            No_Preferred_State No_Null_Position Non_Volatile Bitfield
            Item(Global): Report ID, data= [ 0x7e ] 126
            Item(Global): Usage Page, data= [ 0x86 0xff ] 65414
                            (null)
            Item(Local ): Usage, data= [ 0x42 ] 66
                            (null)
            Item(Local ): String Index, data= [ 0x07 ] 7
            Item(Global): Report Size, data= [ 0x08 ] 8
            Item(Global): Report Count, data= [ 0x01 ] 1
            Item(Global): Logical Minimum, data= [ 0x00 ] 0
            Item(Global): Logical Maximum, data= [ 0xff 0x00 ] 255
            Item(Main  ): Feature, data= [ 0x22 ] 34
                            Data Variable Absolute No_Wrap Linear
                            No_Preferred_State No_Null_Position Non_Volatile Bitfield
            Item(Global): Report ID, data= [ 0x7d ] 125
            Item(Global): Usage Page, data= [ 0x84 ] 132
                            Power Device Page
            Item(Local ): Usage, data= [ 0xff ] 255
                            iSerialNumber
            Item(Local ): String Index, data= [ 0x03 ] 3
            Item(Main  ): Feature, data= [ 0x22 ] 34
                            Data Variable Absolute No_Wrap Linear
                            No_Preferred_State No_Null_Position Non_Volatile Bitfield
            Item(Global): Report ID, data= [ 0x7c ] 124
            Item(Local ): Usage, data= [ 0xfd ] 253
                            iManufacturer
            Item(Local ): String Index, data= [ 0x01 ] 1
            Item(Main  ): Feature, data= [ 0x22 ] 34
                            Data Variable Absolute No_Wrap Linear
                            No_Preferred_State No_Null_Position Non_Volatile Bitfield
            Item(Global): Report ID, data= [ 0x7b ] 123
            Item(Global): Usage Page, data= [ 0x85 ] 133
                            Battery System Page
            Item(Local ): Usage, data= [ 0x85 ] 133
                            Manufacturer Date
            Item(Global): Report Size, data= [ 0x10 ] 16
            Item(Global): Logical Maximum, data= [ 0xff 0xff 0x00 0x00 ] 65535
            Item(Main  ): Feature, data= [ 0xa2 ] 162
                            Data Variable Absolute No_Wrap Linear
                            No_Preferred_State No_Null_Position Volatile Bitfield
            Item(Global): Usage Page, data= [ 0x84 ] 132
                            Power Device Page
            Item(Local ): Usage, data= [ 0x02 ] 2
                            Present Status
            Item(Main  ): Collection, data= [ 0x02 ] 2
                            Logical
            Item(Global): Report ID, data= [ 0x7a ] 122
            Item(Global): Usage Page, data= [ 0x85 ] 133
                            Battery System Page
            Item(Local ): Usage, data= [ 0x44 ] 68
                            Charging
            Item(Global): Report Size, data= [ 0x01 ] 1
            Item(Global): Logical Maximum, data= [ 0x01 ] 1
            Item(Main  ): Feature, data= [ 0xa2 ] 162
                            Data Variable Absolute No_Wrap Linear
                            No_Preferred_State No_Null_Position Volatile Bitfield
            Item(Local ): Usage, data= [ 0x45 ] 69
                            Discharging
            Item(Main  ): Feature, data= [ 0xa2 ] 162
                            Data Variable Absolute No_Wrap Linear
                            No_Preferred_State No_Null_Position Volatile Bitfield
            Item(Local ): Usage, data= [ 0xd0 ] 208
                            AC Present
            Item(Main  ): Feature, data= [ 0xa2 ] 162
                            Data Variable Absolute No_Wrap Linear
                            No_Preferred_State No_Null_Position Volatile Bitfield
            Item(Local ): Usage, data= [ 0xd1 ] 209
                            Battery Present
            Item(Main  ): Feature, data= [ 0xa2 ] 162
                            Data Variable Absolute No_Wrap Linear
                            No_Preferred_State No_Null_Position Volatile Bitfield
            Item(Global): Usage Page, data= [ 0x85 ] 133
                            Battery System Page
            Item(Local ): Usage, data= [ 0x4b ] 75
                            Need Replacement
            Item(Main  ): Feature, data= [ 0xa2 ] 162
                            Data Variable Absolute No_Wrap Linear
                            No_Preferred_State No_Null_Position Volatile Bitfield
            Item(Global): Usage Page, data= [ 0x85 ] 133
                            Battery System Page
            Item(Local ): Usage, data= [ 0xdb ] 219
                            Voltage Not Regulated
            Item(Main  ): Feature, data= [ 0xa2 ] 162
                            Data Variable Absolute No_Wrap Linear
                            No_Preferred_State No_Null_Position Volatile Bitfield
            Item(Global): Usage Page, data= [ 0x84 ] 132
                            Power Device Page
            Item(Local ): Usage, data= [ 0x65 ] 101
                            Overload
            Item(Main  ): Feature, data= [ 0xa2 ] 162
                            Data Variable Absolute No_Wrap Linear
                            No_Preferred_State No_Null_Position Volatile Bitfield
            Item(Global): Report Count, data= [ 0x19 ] 25
            Item(Main  ): Feature, data= [ 0x01 ] 1
                            Constant Array Absolute No_Wrap Linear
                            Preferred_State No_Null_Position Non_Volatile Bitfield
            Item(Main  ): End Collection, data=none
            Item(Global): Report ID, data= [ 0x78 ] 120
            Item(Global): Usage Page, data= [ 0x84 ] 132
                            Power Device Page
            Item(Local ): Usage, data= [ 0x5a ] 90
                            Audible Alarm Control
            Item(Global): Report Size, data= [ 0x08 ] 8
            Item(Global): Report Count, data= [ 0x01 ] 1
            Item(Global): Logical Minimum, data= [ 0x01 ] 1
            Item(Global): Logical Maximum, data= [ 0x03 ] 3
            Item(Main  ): Feature, data= [ 0xa2 ] 162
                            Data Variable Absolute No_Wrap Linear
                            No_Preferred_State No_Null_Position Volatile Bitfield
            Item(Global): Usage Page, data= [ 0xff 0xff ] 65535
                            (null)
            Item(Local ): Usage, data= [ 0xff ] 255
                            (null)
            Item(Main  ): Collection, data= [ 0x02 ] 2
                            Logical
            Item(Global): Report ID, data= [ 0xe3 ] 227
            Item(Local ): Usage, data= [ 0xef ] 239
                            (null)
            Item(Global): Report Size, data= [ 0x08 ] 8
            Item(Global): Report Count, data= [ 0x07 ] 7
            Item(Global): Logical Maximum, data= [ 0xff 0x00 ] 255
            Item(Global): Logical Minimum, data= [ 0x00 ] 0
            Item(Main  ): Input, data= [ 0x82 ] 130
                            Data Variable Absolute No_Wrap Linear
                            Preferred_State No_Null_Position Volatile Bitfield
            Item(Local ): Usage, data= [ 0xef ] 239
                            (null)
            Item(Main  ): Feature, data= [ 0x82 ] 130
                            Data Variable Absolute No_Wrap Linear
                            Preferred_State No_Null_Position Volatile Bitfield
            Item(Main  ): End Collection, data=none
            Item(Main  ): End Collection, data=none
      Endpoint Descriptor:
        bLength                 7
        bDescriptorType         5
        bEndpointAddress     0x81  EP 1 IN
        bmAttributes            3
          Transfer Type            Interrupt
          Synch Type               None
          Usage Type               Data
        wMaxPacketSize     0x0006  1x 6 bytes
        bInterval              10
Device Status:     0x0002
  (Bus Powered)
  Remote Wakeup Enabled
